{
  "version": "1.0.0",
  "last_updated": "2026-05-11T08:12:16Z",
  "sources": {
    "anthropic": {
      "type": "model_provider",
      "last_scanned": "1970-01-01T00:00:00Z",
      "known_version": "",
      "enabled": true
    },
    "openai": {
      "type": "model_provider",
      "last_scanned": "2026-05-11T08:12:16Z",
      "known_version": "v0.17.1",
      "enabled": true
    },
    "google-deepmind": {
      "type": "model_provider",
      "last_scanned": "1970-01-01T00:00:00Z",
      "known_version": "",
      "enabled": true
    },
    "meta-llama": {
      "type": "model_provider",
      "last_scanned": "2026-05-11T08:12:16Z",
      "known_version": "v0.2.0",
      "enabled": true
    },
    "mistralai": {
      "type": "model_provider",
      "last_scanned": "2026-05-11T08:12:16Z",
      "known_version": "v1.11.1",
      "enabled": true
    },
    "deepseek-ai": {
      "type": "model_provider",
      "last_scanned": "2026-05-11T08:12:16Z",
      "known_version": "v1.0.0",
      "enabled": true
    },
    "claude-code": {
      "type": "framework",
      "last_scanned": "1970-01-01T00:00:00Z",
      "known_version": "",
      "enabled": true
    },
    "aider": {
      "type": "framework",
      "last_scanned": "1970-01-01T00:00:00Z",
      "known_version": "",
      "enabled": true
    },
    "cline": {
      "type": "framework",
      "last_scanned": "2026-05-11T08:12:16Z",
      "known_version": "v3.82.0",
      "enabled": true
    },
    "cursor": {
      "type": "framework",
      "last_scanned": "1970-01-01T00:00:00Z",
      "known_version": "",
      "enabled": true
    },
    "langchain": {
      "type": "framework",
      "last_scanned": "1970-01-01T00:00:00Z",
      "known_version": "",
      "enabled": true
    },
    "crewai": {
      "type": "framework",
      "last_scanned": "1970-01-01T00:00:00Z",
      "known_version": "",
      "enabled": true
    },
    "autogen": {
      "type": "framework",
      "last_scanned": "1970-01-01T00:00:00Z",
      "known_version": "",
      "enabled": true
    }
  },
  "scan_history": [
    {
      "timestamp": "2026-05-11T08:12:16Z",
      "scan_type": "full",
      "status": "success",
      "findings_count": 18,
      "high_priority_count": 3,
      "digest_file": "monitor/digests/2026-05-11.md"
    },
    {
      "timestamp": "2026-05-11T07:18:52Z",
      "scan_type": "discover",
      "status": "success",
      "findings_count": 18,
      "high_priority_count": 3,
      "digest_file": "monitor/digests/2026-05-11-weekly.md"
    },
    {
      "timestamp": "2026-05-10T07:44:18Z",
      "scan_type": "full",
      "status": "success",
      "findings_count": 19,
      "high_priority_count": 3,
      "digest_file": "monitor/digests/2026-05-10.md"
    },
    {
      "timestamp": "2026-05-09T07:35:56Z",
      "scan_type": "full",
      "status": "success",
      "findings_count": 20,
      "high_priority_count": 3,
      "digest_file": "monitor/digests/2026-05-09.md"
    },
    {
      "timestamp": "2026-05-08T07:35:07Z",
      "scan_type": "full",
      "status": "success",
      "findings_count": 18,
      "high_priority_count": 3,
      "digest_file": "monitor/digests/2026-05-08.md"
    },
    {
      "timestamp": "2026-05-07T07:56:26Z",
      "scan_type": "full",
      "status": "success",
      "findings_count": 19,
      "high_priority_count": 3,
      "digest_file": "monitor/digests/2026-05-07.md"
    },
    {
      "timestamp": "2026-05-06T07:51:17Z",
      "scan_type": "full",
      "status": "success",
      "findings_count": 18,
      "high_priority_count": 3,
      "digest_file": "monitor/digests/2026-05-06.md"
    },
    {
      "timestamp": "2026-05-05T07:41:37Z",
      "scan_type": "full",
      "status": "success",
      "findings_count": 18,
      "high_priority_count": 3,
      "digest_file": "monitor/digests/2026-05-05.md"
    },
    {
      "timestamp": "2026-05-04T07:58:23Z",
      "scan_type": "full",
      "status": "success",
      "findings_count": 19,
      "high_priority_count": 3,
      "digest_file": "monitor/digests/2026-05-04.md"
    },
    {
      "timestamp": "2026-05-04T07:07:52Z",
      "scan_type": "discover",
      "status": "success",
      "findings_count": 19,
      "high_priority_count": 3,
      "digest_file": "monitor/digests/2026-05-04-weekly.md"
    },
    {
      "timestamp": "2026-05-03T07:38:22Z",
      "scan_type": "full",
      "status": "success",
      "findings_count": 20,
      "high_priority_count": 3,
      "digest_file": "monitor/digests/2026-05-03.md"
    },
    {
      "timestamp": "2026-05-02T07:34:55Z",
      "scan_type": "full",
      "status": "success",
      "findings_count": 17,
      "high_priority_count": 3,
      "digest_file": "monitor/digests/2026-05-02.md"
    },
    {
      "timestamp": "2026-05-01T07:47:26Z",
      "scan_type": "full",
      "status": "success",
      "findings_count": 17,
      "high_priority_count": 3,
      "digest_file": "monitor/digests/2026-05-01.md"
    },
    {
      "timestamp": "2026-04-30T07:47:56Z",
      "scan_type": "full",
      "status": "success",
      "findings_count": 18,
      "high_priority_count": 3,
      "digest_file": "monitor/digests/2026-04-30.md"
    },
    {
      "timestamp": "2026-04-29T07:45:26Z",
      "scan_type": "full",
      "status": "success",
      "findings_count": 17,
      "high_priority_count": 3,
      "digest_file": "monitor/digests/2026-04-29.md"
    },
    {
      "timestamp": "2026-04-28T07:49:25Z",
      "scan_type": "full",
      "status": "success",
      "findings_count": 17,
      "high_priority_count": 3,
      "digest_file": "monitor/digests/2026-04-28.md"
    },
    {
      "timestamp": "2026-04-27T07:49:36Z",
      "scan_type": "full",
      "status": "success",
      "findings_count": 17,
      "high_priority_count": 3,
      "digest_file": "monitor/digests/2026-04-27.md"
    },
    {
      "timestamp": "2026-04-27T06:58:49Z",
      "scan_type": "discover",
      "status": "success",
      "findings_count": 17,
      "high_priority_count": 3,
      "digest_file": "monitor/digests/2026-04-27-weekly.md"
    },
    {
      "timestamp": "2026-04-26T07:34:08Z",
      "scan_type": "full",
      "status": "success",
      "findings_count": 17,
      "high_priority_count": 3,
      "digest_file": "monitor/digests/2026-04-26.md"
    },
    {
      "timestamp": "2026-04-25T07:32:19Z",
      "scan_type": "full",
      "status": "success",
      "findings_count": 18,
      "high_priority_count": 3,
      "digest_file": "monitor/digests/2026-04-25.md"
    },
    {
      "timestamp": "2026-04-24T07:38:45Z",
      "scan_type": "full",
      "status": "success",
      "findings_count": 17,
      "high_priority_count": 3,
      "digest_file": "monitor/digests/2026-04-24.md"
    },
    {
      "timestamp": "2026-04-23T07:36:55Z",
      "scan_type": "full",
      "status": "success",
      "findings_count": 18,
      "high_priority_count": 3,
      "digest_file": "monitor/digests/2026-04-23.md"
    },
    {
      "timestamp": "2026-04-22T07:36:28Z",
      "scan_type": "full",
      "status": "success",
      "findings_count": 18,
      "high_priority_count": 3,
      "digest_file": "monitor/digests/2026-04-22.md"
    },
    {
      "timestamp": "2026-04-21T07:36:34Z",
      "scan_type": "full",
      "status": "success",
      "findings_count": 18,
      "high_priority_count": 3,
      "digest_file": "monitor/digests/2026-04-21.md"
    },
    {
      "timestamp": "2026-04-20T07:38:33Z",
      "scan_type": "full",
      "status": "success",
      "findings_count": 16,
      "high_priority_count": 3,
      "digest_file": "monitor/digests/2026-04-20.md"
    },
    {
      "timestamp": "2026-04-20T06:50:47Z",
      "scan_type": "discover",
      "status": "success",
      "findings_count": 16,
      "high_priority_count": 3,
      "digest_file": "monitor/digests/2026-04-20-weekly.md"
    },
    {
      "timestamp": "2026-04-19T07:33:03Z",
      "scan_type": "full",
      "status": "success",
      "findings_count": 16,
      "high_priority_count": 3,
      "digest_file": "monitor/digests/2026-04-19.md"
    },
    {
      "timestamp": "2026-04-18T07:28:42Z",
      "scan_type": "full",
      "status": "success",
      "findings_count": 16,
      "high_priority_count": 3,
      "digest_file": "monitor/digests/2026-04-18.md"
    },
    {
      "timestamp": "2026-04-17T07:36:23Z",
      "scan_type": "full",
      "status": "success",
      "findings_count": 15,
      "high_priority_count": 3,
      "digest_file": "monitor/digests/2026-04-17.md"
    },
    {
      "timestamp": "2026-04-16T07:36:02Z",
      "scan_type": "full",
      "status": "success",
      "findings_count": 17,
      "high_priority_count": 3,
      "digest_file": "monitor/digests/2026-04-16.md"
    },
    {
      "timestamp": "2026-04-15T07:36:08Z",
      "scan_type": "full",
      "status": "success",
      "findings_count": 16,
      "high_priority_count": 3,
      "digest_file": "monitor/digests/2026-04-15.md"
    },
    {
      "timestamp": "2026-04-14T07:36:07Z",
      "scan_type": "full",
      "status": "success",
      "findings_count": 19,
      "high_priority_count": 3,
      "digest_file": "monitor/digests/2026-04-14.md"
    },
    {
      "timestamp": "2026-04-13T08:03:39Z",
      "scan_type": "discover",
      "status": "success",
      "findings_count": 19,
      "high_priority_count": 3,
      "digest_file": "monitor/digests/2026-04-13-weekly.md"
    },
    {
      "timestamp": "2026-04-13T07:37:36Z",
      "scan_type": "full",
      "status": "success",
      "findings_count": 19,
      "high_priority_count": 3,
      "digest_file": "monitor/digests/2026-04-13.md"
    },
    {
      "timestamp": "2026-04-12T07:32:25Z",
      "scan_type": "full",
      "status": "success",
      "findings_count": 18,
      "high_priority_count": 3,
      "digest_file": "monitor/digests/2026-04-12.md"
    },
    {
      "timestamp": "2026-04-11T07:24:22Z",